Job Title,Salary Estimate,Job Description,Rating,Company Name,Location,Headquarters,Size,Founded,Type of ownership,Industry,Sector,Revenue,Competitors
Data Scientist - co-op,CA$97K-CA$126K (Glassdoor Est.),"Do you want to join a team of talented professionals at an agriculture technology (#ag-tech) company on the verge of explosive international growth? Our company has designed and developed an AI robotics platform which detects crop health in commercial greenhouses internationally, eliminating the need for mass chemical pesticide usage. With exciting products hitting the market in the coming months, we are looking for candidates who are passionate about high technology, food, innovation, and sustainability.

We support our customers completely, we accomplish great things as a team, we are passionate about enabling a cleaner future for everyone, we act like an owner, diversity in all that we do is our strength, success comes because we are great learners, we are persistent and forthright and realistic, and our optimistic nature allows us to take on any challenge.

The candidate should have a background in machine-learning, data mining, statistical learning, computer science or similar. Experience or interest in fields such as agriculture, agronomy, or biology is a definite plus! The intern candidate should also have good software development skills and be a great team player. Your focus is on solving the problem - whether that involves developing a new algorithm or putting on your muddy boots to walk the field. Bring passion, dedication, and creativity to your work and you will have a chance to change the future of agriculture around the world!

Duties & Responsibilities

Your role will involve assisting senior data scientists and data engineers:
Monitor, test, and debug the data pipeline
Develop machine learning procedures and algorithms
Construct classification models using developed machine learning tools
Document developed features in the application
Understand, support, test, and troubleshoot production machine learning applications
Education, Skills & Experience
Ecoation Inc. is looking for an 8 or 12 month commitment
Meeting SWILP eligibility criteria is also preferred: https://www.eco.ca/swilp/studentquiz.aspx",4.3,"Ecoation
4.3",Vancouver,"North Vancouver, Canada",1 to 50 employees,2010,Company - Private,Farm Support Services,Agriculture & Forestry,Unknown / Non-Applicable,-1
Data Scientist,CA$97K-CA$126K (Glassdoor Est.),"People.ai accelerates enterprise growth through the power of AI. With the industry’s only Revenue Intelligence System, People.ai frees all customer-facing teams, including sales, marketing, and customer success, from manual data entry by automatically capturing all contact and customer activity data, dynamically updating CRM and other systems of record, and providing actionable intelligence across management tools to realize the full selling capacity of the enterprise. Some of the world’s best brands are leveraging People.ai to transform their business, including Lyft, New Relic, Okta, Tanium, and Zoom.

At People.ai, we believe that people enrich the world around them in countless ways. We believe that the more time they spend applying their creativity, resourcefulness and critical thinking to activities that matter most in their professional life, the more effective a professional they become. We're developing a deep understanding of the professional world, mapping people, companies, and the information that flows between them through natural language processing and machine learning. Our team is a diverse, outspoken group of creatives and critical thinkers, hyper-focused on driving enterprise growth. We embrace different. We applaud non-traditional career paths. We're inspired by people who have made processes their own.


As a Data Scientist on the Success Services team, you will be responsible for the technical design, implementation, and delivery of our customers’ data for use cases that are not served directly through the product. You will be responsible for managing existing data services, as well as driving all net-new data deliverables owned by Success Services. In addition to the engineering work, you will consult directly with customers, enabling them to build use cases with People.ai data on top of their own infrastructure. This role reports to the Director of Business Value & Insights.
Responsibilities
Serve as the most technically advanced member of the Success Services team as it pertains to data ingestion and manipulation skills and coordinate internally with appropriate technical teams to provide a seamless experience to our customers
Work across Product, Technical Success, and Services to simplify and scale the entire portfolio of Services offerings
Lead logical architecture design in collaboration with Product and Technical Success to enable scalable data models that support value delivery to customers
Assist customers with API configuration and ingesting People.ai data into their analytics infrastructure
Enable customers on People.ai activity data to support their own use cases
Build custom dashboards leveraging our Executive Analytics Platform (embedded BI in web app) along with Product
Create customer-facing documentation for our top dashboards
Optimize refresh schedules for data pipelines and dashboards, both internally and externally
Own the delivery and development of the Historical Contacts Service in coordination with Technical Success
Conduct a backend data design audit of top 5 use cases to ensure scalability moving forward
Requirements
Extensive (5+ years) of coding (e.g. Python, Java, Scala) and data modeling experience
Strong (3+ years) experience with enterprise data analytics architecture, developing data pipelines, and using various ETL libraries/tools
Strong (2+ years) experience building reports in BI tools (e.g. Tableau, Looker, Power BI, Sisense) on top of data warehouses (e.g. Redshift, Snowflake, BigQuery)
Expert at extracting and manipulating data from multiple sources, including relational databases and REST APIs
Working knowledge of cloud-based big data technologies (e.g. Spark, Hive, Hadoop)
Comfortable consulting with customers to enable them to leverage People.ai data within their infrastructure
Must be very organized and know how to accurately and thoroughly document all solutions produced
Values teamwork and good at building partnership cross-functionally
Open to feedback and ideas from others
Creative and innovative
Analytical, data-driven and high-level problem solver
Founded in 2016 and based in San Francisco, the company is backed by ICONIQ Capital, Andreessen Horowitz, Lightspeed Venture Partners, Y Combinator and others. In 2019, People.ai was recognized as a winner of the 2019 Bay Area Best Places To Work, an awards program presented by the San Francisco Business Times and the Silicon Valley Business Journal.",4.4,"People.ai
4.4",Toronto,"San Francisco, CA",51 to 200 employees,2016,Company - Private,Enterprise Software & Network Solutions,Information Technology,Unknown / Non-Applicable,"Clari, Outreach"
"Data Scientist Consultant, Cloud Support Data and Analytics",CA$97K-CA$126K (Glassdoor Est.),"Minimum qualifications:
3 years of experience in an analyst or Data Science role.
Experience using SQL to work with multiple datasets.
Experience designing data models and building data structures.
Experience in a language for statistical computing (R, Python/pandas, Stata, etc.).
Preferred qualifications:
PhD in Statistics, Engineering, Data Science, or related field (e.g. Mathematics, Physics, etc.).
Experience with statistical data analysis (a/b tests, hypothesis testing, experiment setting, etc.), and creating models to answer business questions.
Experience designing databases, and defining and implementing system requirements for data collection.
Knowledge of Machine Learning libraries (such as TensorFlow, Scikit-learn, Keras).
Excellent oral and written communication skills, including the ability to communicate findings in a structured and clear manner to a non-technical audience.
About the job


The Cloud Support Data and Analytics team provides data solutions that power the Cloud Support organization.

In this role, you will work on projects in a growing organization with opportunities to address problems needing creative solutions and models. You will be working on bringing together different data sets from across Google Cloud and modeling data to unlock actionable insights that help stakeholders formulate and answer business questions. You will collaborate closely with stakeholders from technical solutions engineering, product programs, vendor operations, support operations, and support experience teams.

Google Cloud provides organizations with leading infrastructure, platform capabilities and industry solutions. We deliver enterprise-grade cloud solutions that leverage Google’s cutting-edge technology to help companies operate more efficiently and adapt to changing needs, giving customers a foundation for the future. Customers in more than 150 countries turn to Google Cloud as their trusted partner to solve their most critical business problems.
Responsibilities
Provide decision-making support for key projects, and research new ways of modeling data to unlock actionable insights or improve processes. Contribute to the development of the frameworks, tools, skills, and culture for the team and wider organization.
Use predictive analytics and/or machine learning to facilitate forecasting for a growing and global support operation.
Write and review technical documents, including requirements and design documents for existing and future data systems, as well as data standards and policies.
Partner with non-technical stakeholders to understand their needs, help frame the problem by asking the right questions, and document and prioritize requirements. Communicate results of technical work.
Design, write, and support extract, transform, and load (ETL) processes to automate data collection and manage pipelines.

Google is proud to be an equal opportunity workplace and is an affirmative action employer. We are committed to equal employment opportunity regardless of race, color, ancestry, religion, sex, national origin, sexual orientation, age, citizenship, marital status, disability, gender identity or Veteran status. We also consider qualified applicants regardless of criminal histories, consistent with legal requirements. See also Google's EEO Policy and EEO is the Law. If you have a disability or special need that requires accommodation, please let us know by completing this form.",4.4,"Google
4.4",Waterloo,"Mountain View, CA",10000+ employees,1998,Company - Public,Internet,Information Technology,$10+ billion (CAD),"Microsoft, Apple, Facebook"
GCP Data engineer with Dataproc + Big Table,CA$97K-CA$126K (Glassdoor Est.),"GAL AeroStaff., which provides specialized staffing and recruiting services is presently seeking a GCP Data engineer with Dataproc + Big Table for a contract based anywhere in Canada (Remote work)Responsibilities:

Working with GCP team for various GCP Cloud programs including Certifications, Partner engineering, Marketplace and other Cloud platform solutions.
Educating GCP / ISVs customers on best practices
Stakeholders management / Communication: Google, ISVs, Project Teams
Program Management and Execution
Managing the teams on different projects
Reporting and Project Communications
Advocating the customer's perspective during product and architecture planning.
Create and maintain a library of reusable container images
Awareness of Business P&L and Goals aligned to technology and revenue

Certifications:

GCP Cloud Certification is Must
Google Cloud Certified Professional Data Engineer
Google Cloud Certified Professional Cloud Architect

Technical Skills:

Experience with private, hybrid or public cloud technology
Possess Strong Cloud Implementation Experience in Cloud architecture/design, compute/storage services.
Understand multi-Cloud/multi-zone based designs.
Compute: Docker Apps, Lambda/ serverless, UserData customization
Preferred: Cluster/HA-based parallel design/multi-region approach
Cloud automation: Ansible, YAML, CloudFormation
Containers: Docker; Preferred: Container orchestration - Mesosphere, Kubernetes, ECS
Familiarity with functional operations of server, storage, and network functions.
Experience migrating Windows or Linux
Virtualization experience (VMware, Xen, HyperV)
Databases understanding: Oracle, DB2,MySql; Preferred: NoSql DB, MongoDB, Cassandra, DynamoDB
Program Management experience from Planning to execution
Having experience of Managing teams of moderate size
Strong communications skill and multiple stakeholder(TM)s management
Experience in implementing cloud solutions",4.0,"GAL Aerostaff
4.0",Remote,"Vaudreuil-Dorion, Canada",1 to 50 employees,2011,Company - Private,Aerospace & Defence,Aerospace & Defence,Unknown / Non-Applicable,-1
Data Scientist,CA$97K-CA$126K (Glassdoor Est.),"ABOUT MOBSQUAD

We are a well-funded, hyper-growth, scale-up looking for an experienced Data Scientist. If you've ever dreamed of working with a top tier technology company scale-up, on leading edge technologies, backed by the very best venture capitalists in the world, then this is your chance.

Some details about MobSquad:
MobSquad solves the significant and growing technology talent shortage faced by US-based start-ups and scale-ups by enabling our clients to quickly have a turnkey ""virtual"" Canadian subsidiary, where Canadian-based software engineers serve our clients individually on an exclusive basis
We've been featured on the front page of The Washington Post , on NPR multiple times, The Financial Times (UK), The Globe and Mail, the Calgary Herald, BetaKit, CBC, Global News, and many other places. other media outlets
We're a Certified B Corporation, were recognized as the third Best Place to Work in Canada in 2020, and have made numerous contributions to charitable organizations as well as a financial commitment to the Upside Foundation. We believe we are playing a key role in enhancing Canada's innovation economy, and have received financial support from the Government of Canada, Province of Alberta, Province of Nova Scotia, and City of Calgary, to support this ambition
You can learn more about us on our website

ABOUT THE ROLE

As a Data Scientist, you will be part of a Canada-based team working remotely for a leading US start-up. Your team will operate alongside many other talented developers and data scientists in Canada, and you will be an integral part of the tech community that MobSquad has built.

This role requires someone who has demonstrated an ability to bridge the gap between the theoretical and the practical. The ideal candidate has deployed or attempted to execute Artificial Intelligence theories from various Machine Learning (ML) models and algorithms, and also has some experience in data engineering. MobSquad is looking for proven researchers with a track record of publishing in impactful journals and conferences, or those with years of hands-on industry experience.

This role offers the opportunity to apply your knowledge of statistics and your analytical skills to mine data at scale and develop large-scale ML models to reveal the value in data. You will support feature prototyping and utilize best practices to write production-grade code. You will build data pipelines, implement ML-based analytical algorithms, and work closely with the software development team to set up back-end systems and interfaces that will deliver next-generation analytics.

ABOUT YOU

You have an advanced degree (M.S. or PhD) in Data Science, Computer Science, Engineering, or a comparable analytical field from an accredited institution
You are expert in data mining, machine learning, deep learning, statistical modeling, and data visualization techniques using data-oriented tools and languages such as Python, R, and MATLAB
You have over three years of experience or demonstrated fluency in relevant programming languages (Python, R, Scala, Java, C/C++, C#)
You have over three years of experience working with SQL (MySQL, SQL Server) as well as NoSQL (Cassandra, Hbase) databases
You have experience setting up and using large-scale distributed data-processing frameworks such as Apache Spark and Hadoop MapReduce
You have experience working with enterprise-grade cloud computing platforms such as Microsoft Azure, Amazon Web Services, or Google Cloud
You have demonstrated ability to develop high-quality code adhering to industry best practices (e.g., code review, unit testing, revision control)
You are familiar with designing experiments and collecting data for the purpose of deriving data analytics insights and solutions
You have experiencing creating and deploying recommendation and/or predictive models
You have work/project history reflective of a self-motivated professional who excels when given open-ended problems and broadly-defined goals, having an innate desire to discover the patterns and relationships in data that can be leveraged to provide business value

WHAT YOU'LL GET @MOBSQUAD

A full-time position that offers competitive compensation
A benefits program delivered through our bespoke digital platform, giving you control, choice, and flexibility. We give you the ability to build your package of benefits covering health (e.g., medical, dental, vision), wellness (e.g., gym, workout gear, massage, transit), and RRSP (retirement savings)
A downtown office location with first-rate amenities, surrounded by great restaurants and easily-accessible transit
For international candidates, sponsorship for an immediate work permit, expedited permanent residency, and Canadian citizenship within four years

At MobSquad, we support and encourage building a work environment that is diverse, inclusive, and safe for all. We invite and welcome applicants of all backgrounds, regardless of race, religion, sexual orientation, gender identity, national origin, or disability.",4.4,"MobSquad
4.4",Calgary,"Calgary, Canada",1 to 50 employees,-1,Company - Private,Computer Hardware & Software,Information Technology,Unknown / Non-Applicable,-1
Data Scientist,CA$97K-CA$126K (Glassdoor Est.),"Data Scientist

INVISTA Canada's Kingston Nylon manufacturing
site located in Kingston, Ontario is looking for a Data Scientist to support INVISTA’s
manufacturing plants around the world. A
successful candidate will be responsible for leveraging INVISTA’s data assets -
thousands of sources and billions of records from across our operations – to
improve the company’s business performance.

It is an exciting phase in INVISTA’s
continued evolution through
growth and transformation projects. This
position will be a key strategic addition in growing the capability of our global
operations to make data driven decisions.

We are looking for motivated and talented people who will help us
meet the challenge of leading rapid experimentation, pursuing continuous
innovation and creating long-term value for customers and society. INVISTA is an
independently managed but wholly owned subsidiary of Koch Industries, Inc.
Why Work for INVISTA?
A culture that
places top priority on integrity and compliance
Supported by
INVISTA’s Data Engineering team so the scientist can focus on
experimentation and validation
An opportunity to
learn from analytics experts at INVISTA and collaborate in solving
challenges across other companies at Koch Industries
Leading
implementation of advanced analytics to transform INVISTA operations towards
the factory of the future

Position Responsibilities:

As a member of the INVISTA team, you will
have the opportunity to work in a fast-paced manufacturing environment with an
aim to drive data oriented solutions to operations and commercial needs . You
will:
Work with operations and
commercial stakeholders to identify opportunities for leveraging data and
analytics to drive business solutions across the entire Performance
Solutions business.
Explore and analyze data to
drive optimization and improvement of data informed decisions
Assess the effectiveness and
accuracy of new data sources and data gathering techniques.
Develop data models and Machine
Learning algorithms and implement these capabilities at scale.
Coordinate with different
functional teams to implement models and monitor outcomes.
Develop processes and tools to
monitor and analyze model performance and data accuracy.
Coaching and mentorship for
developing analytics capability across the organization.
To generate the greatest contribution to our
company, you must be results driven, thrive in team-oriented work environment, an
economic thinker, and have excellent communication skills to be able to work
with all areas of the organization.

Above all you must ensure that all your
activities are carried out with integrity and in a safe and efficient manner.
Skill Requirements:

A degree in engineering, computer science, mathematics
or similar field with a focus on Data Science/Data Mining/Data Analytics
Experience with a Programming Language (Python, R,
Scala, Julia, Java)
Experience or education working with the various data
storage mechanisms (Hadoop ecosystem, Microsoft SQL, Oracle)
Exposure to predictive analytics tools (R, TensorFlow,
PyTorch, SAS, Knime, Apache Spark) and concepts (classification,
regression, clustering, neural networks)
Previous work experience in the field is an
asset but not required

Compensation:

Competitive salary commensurate with skills
and experience.


We provide:

Competitive salary
Flexible benefits
package
Defined benefit
pension plan
Optional pension
enhancements
Performance bonus
program
Additional
vacation purchase program
Additional
floating holidays
Education
Assistance Program for job related training

About INVISTA

From the fibers in your carpet to the plastic
in your automobiles, INVISTA’s commitment to continuous improvement has
led its employees to develop some of the most durable, versatile polymers and
fibers in the world. A subsidiary of Koch Industries since 2004, INVISTA
brings to market the proprietary ingredients for nylon 6,6 and recognized
brands including STAINMASTER®, CORDURA® and ANTRON®.

INVISTA also offers specialty chemical
intermediates and process technologies. See the bigger picture at INVISTA.com

Want to learn more about the INVISTA
experience? Watch this!

To find out more about working at INVISTA’s
Kingston Site: Watch this!

To find out about working and living in
Kingston, please visit: https://possiblemadehere.org/

How to apply?

Interested applicants should submit a
detailed resume along with a covering letter to www.invistacareers.com

If you
have the above qualifications, we would like to hear from you. We thank all
applicants, in advance, and advise that only those selected for an interview
will be contacted.

Successful
candidates will be required to complete a criminal background check.

We are an
equal opportunity employer. If you require accommodation or assistance at any
time during the application or selection processes, please submit a request by
following the directions located at the bottom of kochcareers.com webpage.",3.5,"INVISTA
3.5",Kingston,"Wichita, KS",10000+ employees,-1,Subsidiary or Business Segment,Chemical Manufacturing,Manufacturing,Unknown / Non-Applicable,-1
Junior Data Scientist,CA$97K-CA$126K (Glassdoor Est.),"You will:
Work with existing data manipulation tools to populate our database.
Work with our development team to automate the flow of data.
Qualifications
You are familiar with the pace of a start-up going into a growth phase.

You have:
Enthusiasm to work in Blockchain
Excellent problem-solving skills
Detail-orientation throughout the development lifecycle
Ability to work with little supervision
Passion for Data Science

Nice to have:
Experience with Crypto-Currencies; e.g. Ethereum, Bitcoin, etc
Understanding of how Crypto-Currency mining works

Benefits:
Work from home opportunities
Job Type: Full-time, Temporary
Salary: $48,000 to $60,000 / year
Send your resume to careers@dmgblockchain.com with the position as the subject.",-1,DMG BLOCKCHAIN SOLUTIONS,Vancouver,"Vancouver, Canada",51 to 200 employees,-1,Company - Public,Computer Hardware & Software,Information Technology,Unknown / Non-Applicable,-1
